{"schemaVersion":"1.0.0","profile":"standard","scenarios":[{"id":"skill-creator:1","source":"skills/skill-creator/evals/evals.json","selector":"/evals/0"}],"baseline":"baseline","configurations":[{"id":"baseline","executionLevel":"behavioral","capabilities":["filesystem","agent_runner"],"modelRoles":[{"role":"subject","model":"model-a"}],"inputs":["skill-creator:1"],"tools":["developer"],"fixtures":["assets/fixture"]},{"id":"candidate","executionLevel":"behavioral","capabilities":["agent_runner","filesystem"],"modelRoles":[{"role":"subject","model":"model-b"}],"inputs":["skill-creator:1"],"tools":["developer"],"fixtures":["assets/fixture"]}],"pairs":[{"baseline":"baseline","candidate":"candidate","equivalent":{"inputs":true,"tools":true,"fixtures":true,"budgets":true}}],"thresholds":[{"metric":"assertion_pass_rate","operator":">=","value":0.9}]}
